<?xml version="1.0" encoding="UTF-8"?>
<filmak xmlns:xsi="http://www.w3.org/2001/XMLSchema-instance"
            xsi:noNamespaceSchemaLocation="filmak.xsd">
    <filma id="1">
        <izenburua>Inception</izenburua>
        <zuzendaria>Christopher Nolan</zuzendaria>
        <urtea>2010</urtea>
    </filma>
    <filma id="2">
        <izenburua>Spirited Away</izenburua>
        <zuzendaria>Hayao Miyazaki</zuzendaria>
        <urtea>2001</urtea>
    </filma>
</filmak>
